{
  "index_version": "xinsight.execution-evidence-fixture-index.v1",
  "schema_id": "urn:x-insight:incubation:unirouter-execution-evidence-consumer-candidate:0.1.0",
  "schema_version": "0.1.0-draft",
  "schema_content_sha256": "sha256:abd055cbfc53367664a734df47c5efffca2bad3632782fd77a00599868457044",
  "fixtures": [
    {"fixture_id":"xinsight.draft-evidence.cancelled","fixture_version":"1.0.0","path":"fixtures/accept/cancelled.json","content_sha256":"sha256:026caaccce2d7bf41967952e681f294f1a527accc64c49089942d99b5f3b2153","origin_kind":"source_derived","expectation":"accept","scenario_id":"cancelled","capability_claim_boundary":"conformance_only_not_unirouter_capability_or_release_evidence"},
    {"fixture_id":"xinsight.draft-evidence.duplicate-delivery","fixture_version":"1.0.0","path":"fixtures/accept/duplicate-delivery.json","content_sha256":"sha256:b426aa0a668598592e10cc634e3d9b295d76e373a995846e1618c6fae4ada66d","origin_kind":"synthetic_contract_fixture","expectation":"accept","scenario_id":"duplicate-delivery","capability_claim_boundary":"conformance_only_not_unirouter_capability_or_release_evidence"},
    {"fixture_id":"xinsight.draft-evidence.fallback","fixture_version":"1.0.0","path":"fixtures/accept/fallback.json","content_sha256":"sha256:c25a6d192b910f8ccdb2c326515189a6e525b009f3ee2a8f4ce16f8709f548ba","origin_kind":"hypothesis_only","expectation":"accept","scenario_id":"fallback","capability_claim_boundary":"conformance_only_not_unirouter_capability_or_release_evidence"},
    {"fixture_id":"xinsight.draft-evidence.gap-unknown","fixture_version":"1.0.0","path":"fixtures/accept/gap-unknown.json","content_sha256":"sha256:cdf08bf8303927482de58b658e312e3c6a6c6a6fe8993cca20f80754bafd77b1","origin_kind":"hypothesis_only","expectation":"accept","scenario_id":"gap-unknown","capability_claim_boundary":"conformance_only_not_unirouter_capability_or_release_evidence"},
    {"fixture_id":"xinsight.draft-evidence.predispatch-denied","fixture_version":"1.0.0","path":"fixtures/accept/predispatch-denied.json","content_sha256":"sha256:ede3508b0d36bb9c4a239fab722b497e6c5ef5f44b9b6da47e04bd407dd4f75b","origin_kind":"synthetic_contract_fixture","expectation":"accept","scenario_id":"predispatch-denied","capability_claim_boundary":"conformance_only_not_unirouter_capability_or_release_evidence"},
    {"fixture_id":"xinsight.draft-evidence.reasoning-evidence","fixture_version":"1.0.0","path":"fixtures/accept/reasoning-evidence.json","content_sha256":"sha256:bad94fada784f0bd74266b2e335df940daf3dd7d9d04fe28fbf6c280400bda0c","origin_kind":"synthetic_contract_fixture","expectation":"accept","scenario_id":"reasoning-evidence","capability_claim_boundary":"conformance_only_not_unirouter_capability_or_release_evidence"},
    {"fixture_id":"xinsight.draft-evidence.reconciliation-after-terminal","fixture_version":"1.0.0","path":"fixtures/accept/reconciliation-after-terminal.json","content_sha256":"sha256:c51d22425c9fda64f2c6d42d483bf458b593291c98d52d53daf7923d72029ffb","origin_kind":"synthetic_contract_fixture","expectation":"accept","scenario_id":"reconciliation-after-terminal","capability_claim_boundary":"conformance_only_not_unirouter_capability_or_release_evidence"},
    {"fixture_id":"xinsight.draft-evidence.refund-after-terminal","fixture_version":"1.0.0","path":"fixtures/accept/refund-after-terminal.json","content_sha256":"sha256:45b180d5167e24e00dc381d5eac0ce358bc0b5ecbd5232d1d638874b45f4dff2","origin_kind":"synthetic_contract_fixture","expectation":"accept","scenario_id":"refund-after-terminal","capability_claim_boundary":"conformance_only_not_unirouter_capability_or_release_evidence"},
    {"fixture_id":"xinsight.draft-evidence.relates-to","fixture_version":"1.0.0","path":"fixtures/accept/relates-to.json","content_sha256":"sha256:2aba0e3ee5ea2e1866aee011881c8638e5ee3d62f5cc2c8ee3056800cf1ca417","origin_kind":"synthetic_contract_fixture","expectation":"accept","scenario_id":"relates-to","capability_claim_boundary":"conformance_only_not_unirouter_capability_or_release_evidence"},
    {"fixture_id":"xinsight.draft-evidence.retry","fixture_version":"1.0.0","path":"fixtures/accept/retry.json","content_sha256":"sha256:071755f939bdd303492c0759961bb114dcb379bf89f4719450ec8d0cb642ed49","origin_kind":"synthetic_contract_fixture","expectation":"accept","scenario_id":"retry","capability_claim_boundary":"conformance_only_not_unirouter_capability_or_release_evidence"},
    {"fixture_id":"xinsight.draft-evidence.revision-of","fixture_version":"1.0.0","path":"fixtures/accept/revision-of.json","content_sha256":"sha256:c7db398d50164e8a9600fb0209900201648e95e3955a73c9f949416c48ec3886","origin_kind":"synthetic_contract_fixture","expectation":"accept","scenario_id":"revision-of","capability_claim_boundary":"conformance_only_not_unirouter_capability_or_release_evidence"},
    {"fixture_id":"xinsight.draft-evidence.single-attempt-success","fixture_version":"1.0.0","path":"fixtures/accept/single-attempt-success.json","content_sha256":"sha256:8d0ea9cfe06ede62d29aabee2df7a95aba71f45ec82ce2fb90f731bb893efe8e","origin_kind":"source_derived","expectation":"accept","scenario_id":"single-attempt-success","capability_claim_boundary":"conformance_only_not_unirouter_capability_or_release_evidence"},
    {"fixture_id":"xinsight.draft-evidence.source-caused-by","fixture_version":"1.0.0","path":"fixtures/accept/source-caused-by.json","content_sha256":"sha256:3f8622767d6b80e74b87562ec7057fbbd46f5df84e52860cdf7555bb357df3e0","origin_kind":"synthetic_contract_fixture","expectation":"accept","scenario_id":"source-caused-by","capability_claim_boundary":"conformance_only_not_unirouter_capability_or_release_evidence"},
    {"fixture_id":"xinsight.draft-evidence.source-derived-from","fixture_version":"1.0.0","path":"fixtures/accept/source-derived-from.json","content_sha256":"sha256:b25f8c579c50c3c41b891892afde4219e26ba12bf18bc96e57da668c390ce1d1","origin_kind":"synthetic_contract_fixture","expectation":"accept","scenario_id":"source-derived-from","capability_claim_boundary":"conformance_only_not_unirouter_capability_or_release_evidence"},
    {"fixture_id":"xinsight.draft-evidence.streaming-terminal-usage","fixture_version":"1.0.0","path":"fixtures/accept/streaming-terminal-usage.json","content_sha256":"sha256:9171785be0b0889404d2743c2b817188598a24278c79dd9b5fb0bf36f8c1378b","origin_kind":"synthetic_contract_fixture","expectation":"accept","scenario_id":"streaming-terminal-usage","capability_claim_boundary":"conformance_only_not_unirouter_capability_or_release_evidence"},
    {"fixture_id":"xinsight.draft-evidence.supersedes-correction","fixture_version":"1.0.0","path":"fixtures/accept/supersedes-correction.json","content_sha256":"sha256:33d70e35d79cc279b60f05e50dae6be462c79c0ab7fe0ec11c97ebf334a57694","origin_kind":"synthetic_contract_fixture","expectation":"accept","scenario_id":"supersedes-correction","capability_claim_boundary":"conformance_only_not_unirouter_capability_or_release_evidence"},
    {"fixture_id":"xinsight.draft-evidence.tool-choice","fixture_version":"1.0.0","path":"fixtures/accept/tool-choice.json","content_sha256":"sha256:f0a4f2ebee5e83dcaa2d38914f42335544359fe0483c9098a88b98c40c6dd3af","origin_kind":"synthetic_contract_fixture","expectation":"accept","scenario_id":"tool-choice","capability_claim_boundary":"conformance_only_not_unirouter_capability_or_release_evidence"},
    {"fixture_id":"xinsight.draft-evidence.compatibility-commitment","fixture_version":"1.0.0","path":"fixtures/reject/compatibility-commitment.json","content_sha256":"sha256:5d2a602d29ff1d7a1361d03e7ac47a3d3e635372e9ce6c9afa51db605e6fa6d9","origin_kind":"synthetic_contract_fixture","expectation":"reject","expected_validation_error":"value must be 'none'","scenario_id":"compatibility-commitment","capability_claim_boundary":"conformance_only_not_unirouter_capability_or_release_evidence"},
    {"fixture_id":"xinsight.draft-evidence.cursor-as-revision","fixture_version":"1.0.0","path":"fixtures/reject/cursor-as-revision.json","content_sha256":"sha256:cd16e55a8f0cca06e006f80f8a6fc19b0a570deae96a0f859936bfc1e6f4f8e9","origin_kind":"synthetic_contract_fixture","expectation":"reject","expected_validation_error":"at '/evidence/facts/0/kind': value must be one of","scenario_id":"cursor-as-revision","capability_claim_boundary":"conformance_only_not_unirouter_capability_or_release_evidence"},
    {"fixture_id":"xinsight.draft-evidence.delivery-retry-new-fact","fixture_version":"1.0.0","path":"fixtures/reject/delivery-retry-new-fact.json","content_sha256":"sha256:12ce73fd528365f23075f9f54d3664e0872bd1aef54e829a58ac1bb181d72399","origin_kind":"synthetic_contract_fixture","expectation":"reject","expected_validation_error":"duplicate delivery must not mint a second business fact","scenario_id":"delivery-retry-new-fact","capability_claim_boundary":"conformance_only_not_unirouter_capability_or_release_evidence"},
    {"fixture_id":"xinsight.draft-evidence.duplicate-usage-cardinality","fixture_version":"1.0.0","path":"fixtures/reject/duplicate-usage-cardinality.json","content_sha256":"sha256:75a1e4707ace5f941dffa6d8a003a76230c9456791ccb4e92456704437a7ef3c","origin_kind":"synthetic_contract_fixture","expectation":"reject","expected_validation_error":"usage cardinality exceeds one without same-Source revision semantics","scenario_id":"duplicate-usage-cardinality","capability_claim_boundary":"conformance_only_not_unirouter_capability_or_release_evidence"},
    {"fixture_id":"xinsight.draft-evidence.fact-ordering","fixture_version":"1.0.0","path":"fixtures/reject/fact-ordering.json","content_sha256":"sha256:6c6b617de619c1e24c2b6afb5449b20100bd0ec33c334d7b5d4c9af7ebccf43b","origin_kind":"synthetic_contract_fixture","expectation":"reject","expected_validation_error":"fact sequence must be contiguous and ordered from one","scenario_id":"fact-ordering","capability_claim_boundary":"conformance_only_not_unirouter_capability_or_release_evidence"},